<?xml version="1.0" encoding="UTF-8"?>
<!-- URL https://raw.githubusercontent.com/foleyj2/ontology-ad/master/xml/msdd.xml -->
<msddnode xmlns="https://raw.githubusercontent.com/foleyj2/ontology-ad/master/xml/msdd.xsd"
	  xmlns:xsi="www.w3.org/2001/XMLSchema-instance"
	  xsi:schemaLocation="https://raw.githubusercontent.com/foleyj2/ontology-ad/master/xml/msdd.xsd"
	  id="1">
  <fr>Maximize long term return on investment</fr>
  <pm>Return on Investment over system lifecycle</pm>
  <dp>Manufacturing System Design (MSD)</dp>
  <msddnode id="11">
    <fr>Maximize sales revenue</fr>
    <pm>Sales revenue</pm>
    <dp>Manufacturing system designed for customer satisfaction</dp>
    <couplingid>12</couplingid>
  </msddnode>
  <msddnode id="12">
    <fr>Minimize manufacturing costs</fr>
    <pm>Manufacturing costs</pm>
    <dp>Elimination of non-value adding sources of cost</dp>
    <couplingid>13</couplingid>
  </msddnode>
  <msddnode id="13">
    <fr>Minimize investment over manufacturing system lifecycle</fr>
    <pm>Investment over system lifecycle</pm>
    <dp>Resource investment to achieve system FRs</dp>
  </msddnode>
</msddnode>
